{
  "metadata": {
    "document_id": "PRD-2024-001",
    "title": "ユーザー認証機能",
    "version": "1.0.0",
    "status": "approved",
    "created_date": "2024-01-15",
    "last_updated": "2024-01-20",
    "author": "Product Manager",
    "reviewers": ["Tech Lead", "Security Lead"],
    "approvers": ["CTO"]
  },
  "executive_summary": {
    "overview": "本機能は、セキュアで使いやすいユーザー認証システムを提供します。メールアドレスとパスワードによる認証を基本とし、将来的にはOAuth連携も視野に入れています。",
    "value_proposition": "ユーザーの個人情報を安全に管理し、パーソナライズされた体験を提供することで、エンゲージメント率30%向上を目指す",
    "target_release": "2024年Q2"
  },
  "problem_statement": {
    "current_situation": "現在のシステムでは、ユーザーを識別する仕組みがないため、全てのユーザーが匿名でアクセスしています。これにより、パーソナライズされたコンテンツ提供や、ユーザー固有のデータ保存ができない状況です。",
    "problems": [
      {
        "id": "P-001",
        "description": "ユーザーを識別できないため、パーソナライズされた体験を提供できない",
        "severity": "high",
        "affected_users": "全ユーザー"
      },
      {
        "id": "P-002",
        "description": "ユーザーデータを永続化できないため、セッション間でデータが失われる",
        "severity": "high",
        "affected_users": "リピートユーザー"
      }
    ],
    "impact": "ユーザーリテンション率が業界平均を30%下回っており、収益機会を逸失している"
  },
  "goals": {
    "business_goals": [
      {
        "id": "BG-001",
        "description": "ユーザーリテンション率の向上",
        "metric": "30日リテンション率",
        "target": "40%以上（現状25%）"
      },
      {
        "id": "BG-002",
        "description": "ユーザーデータの収集と活用",
        "metric": "登録ユーザー数",
        "target": "リリース後3ヶ月で10,000人"
      }
    ],
    "product_goals": [
      {
        "id": "PG-001",
        "description": "セキュアな認証システムの構築",
        "priority": "must-have"
      },
      {
        "id": "PG-002",
        "description": "スムーズな登録・ログイン体験の提供",
        "priority": "must-have"
      },
      {
        "id": "PG-003",
        "description": "パスワードリセット機能の提供",
        "priority": "should-have"
      }
    ],
    "non_goals": [
      "OAuth/ソーシャルログインは次期リリースで対応",
      "二要素認証は次期リリースで対応",
      "企業向けSSO連携はスコープ外"
    ]
  },
  "user_personas": [
    {
      "id": "P-001",
      "name": "新規ユーザー（田中さん）",
      "description": "サービスを初めて利用する一般ユーザー。シンプルで素早い登録を望む。",
      "demographics": {
        "age_range": "25-40",
        "occupation": "会社員",
        "tech_savviness": "intermediate"
      },
      "goals": [
        "すぐにサービスを使い始めたい",
        "複雑な手続きは避けたい",
        "個人情報は安全に管理されたい"
      ],
      "pain_points": [
        "長い入力フォーム",
        "分かりにくいエラーメッセージ",
        "パスワードルールが厳しすぎる"
      ],
      "scenarios": [
        "スマートフォンで移動中に登録を完了したい"
      ]
    },
    {
      "id": "P-002",
      "name": "リピートユーザー（鈴木さん）",
      "description": "過去に登録済みで、定期的にサービスを利用するユーザー。",
      "demographics": {
        "age_range": "30-50",
        "occupation": "自営業",
        "tech_savviness": "advanced"
      },
      "goals": [
        "素早くログインしたい",
        "パスワードを忘れても復旧できる",
        "セッションを維持したい"
      ],
      "pain_points": [
        "毎回ログインが必要",
        "パスワードを忘れがち"
      ]
    }
  ],
  "requirements": {
    "functional": [
      {
        "id": "FR-001",
        "description": "ユーザーはメールアドレスとパスワードで新規登録できる",
        "priority": "must-have",
        "status": "approved",
        "rationale": "基本的な認証フローとして必須",
        "verification_method": "test",
        "related_user_stories": ["US-001"]
      },
      {
        "id": "FR-002",
        "description": "パスワードは8文字以上で、英大文字・英小文字・数字を含む必要がある",
        "priority": "must-have",
        "status": "approved",
        "rationale": "セキュリティ基準を満たすため",
        "verification_method": "test",
        "related_user_stories": ["US-001"]
      },
      {
        "id": "FR-003",
        "description": "ユーザーは登録済みのメールアドレスとパスワードでログインできる",
        "priority": "must-have",
        "status": "approved",
        "verification_method": "test",
        "related_user_stories": ["US-002"]
      },
      {
        "id": "FR-004",
        "description": "ログイン失敗時は適切なエラーメッセージを表示する",
        "priority": "must-have",
        "status": "approved",
        "verification_method": "test",
        "related_user_stories": ["US-002"]
      },
      {
        "id": "FR-005",
        "description": "ユーザーはパスワードリセットをメールで依頼できる",
        "priority": "should-have",
        "status": "approved",
        "verification_method": "test",
        "related_user_stories": ["US-003"]
      }
    ],
    "non_functional": [
      {
        "id": "NFR-001",
        "description": "認証APIのレスポンスタイムは200ms以下",
        "priority": "must-have",
        "status": "approved",
        "verification_method": "test"
      },
      {
        "id": "NFR-002",
        "description": "パスワードはbcryptでハッシュ化して保存",
        "priority": "must-have",
        "status": "approved",
        "verification_method": "inspection"
      },
      {
        "id": "NFR-003",
        "description": "認証システムは99.9%の可用性を維持",
        "priority": "must-have",
        "status": "approved",
        "verification_method": "analysis"
      }
    ]
  },
  "user_stories": [
    {
      "id": "US-001",
      "persona": "新規ユーザー",
      "want": "メールアドレスとパスワードで登録したい",
      "so_that": "サービスの機能を利用できるようになる",
      "acceptance_criteria": [
        {
          "given": "未登録のユーザーが登録ページにいる",
          "when": "有効なメールアドレスと8文字以上のパスワードを入力して送信する",
          "then": "アカウントが作成され、確認メールが送信される"
        },
        {
          "given": "未登録のユーザーが登録ページにいる",
          "when": "既に登録済みのメールアドレスを入力する",
          "then": "エラーメッセージが表示される"
        },
        {
          "given": "未登録のユーザーが登録ページにいる",
          "when": "8文字未満のパスワードを入力する",
          "then": "バリデーションエラーが表示される"
        }
      ],
      "priority": "must-have",
      "story_points": 5,
      "related_requirements": ["FR-001", "FR-002"]
    },
    {
      "id": "US-002",
      "persona": "登録済みユーザー",
      "want": "メールアドレスとパスワードでログインしたい",
      "so_that": "自分のアカウントにアクセスできる",
      "acceptance_criteria": [
        {
          "given": "登録済みユーザーがログインページにいる",
          "when": "正しいメールアドレスとパスワードを入力する",
          "then": "ログインが成功し、ダッシュボードに遷移する"
        },
        {
          "given": "登録済みユーザーがログインページにいる",
          "when": "間違ったパスワードを入力する",
          "then": "エラーメッセージが表示される"
        }
      ],
      "priority": "must-have",
      "story_points": 3,
      "related_requirements": ["FR-003", "FR-004"]
    },
    {
      "id": "US-003",
      "persona": "登録済みユーザー",
      "want": "パスワードを忘れた場合にリセットしたい",
      "so_that": "アカウントへのアクセスを回復できる",
      "acceptance_criteria": [
        {
          "given": "ユーザーがパスワードリセットページにいる",
          "when": "登録済みのメールアドレスを入力する",
          "then": "パスワードリセットリンクがメールで送信される"
        }
      ],
      "priority": "should-have",
      "story_points": 3,
      "related_requirements": ["FR-005"]
    }
  ],
  "success_metrics": {
    "kpis": [
      {
        "id": "KPI-001",
        "name": "登録完了率",
        "description": "登録を開始したユーザーのうち完了した割合",
        "baseline": "N/A",
        "target": "80%以上",
        "measurement_method": "Analytics",
        "frequency": "Weekly"
      },
      {
        "id": "KPI-002",
        "name": "ログイン成功率",
        "description": "ログイン試行のうち成功した割合",
        "baseline": "N/A",
        "target": "95%以上",
        "measurement_method": "Server logs",
        "frequency": "Daily"
      },
      {
        "id": "KPI-003",
        "name": "30日リテンション率",
        "description": "登録後30日以内に再訪問したユーザーの割合",
        "baseline": "25%",
        "target": "40%以上",
        "measurement_method": "Analytics",
        "frequency": "Monthly"
      }
    ],
    "okrs": [
      {
        "objective": "ユーザーがストレスなく認証できるようにする",
        "key_results": [
          "登録完了率80%以上を達成",
          "平均登録時間60秒以下を達成",
          "認証関連のサポート問い合わせを月10件以下に抑える"
        ]
      }
    ]
  },
  "timeline": {
    "milestones": [
      {
        "name": "設計完了",
        "target_date": "2024-02-01",
        "deliverables": ["SRS", "API設計書", "UI/UXデザイン"]
      },
      {
        "name": "開発完了",
        "target_date": "2024-03-15",
        "deliverables": ["実装コード", "ユニットテスト", "統合テスト"]
      },
      {
        "name": "QA完了",
        "target_date": "2024-03-25",
        "deliverables": ["テスト結果レポート", "バグ修正"]
      },
      {
        "name": "リリース",
        "target_date": "2024-04-01",
        "deliverables": ["本番デプロイ", "リリースノート"]
      }
    ],
    "phases": [
      {
        "name": "設計フェーズ",
        "start_date": "2024-01-15",
        "end_date": "2024-02-01",
        "description": "要件定義、技術設計、UI/UXデザイン"
      },
      {
        "name": "開発フェーズ",
        "start_date": "2024-02-05",
        "end_date": "2024-03-15",
        "description": "実装、ユニットテスト、コードレビュー"
      },
      {
        "name": "テストフェーズ",
        "start_date": "2024-03-18",
        "end_date": "2024-03-25",
        "description": "統合テスト、E2Eテスト、セキュリティテスト"
      }
    ]
  },
  "risks": [
    {
      "id": "R-001",
      "description": "メール配信の信頼性が低い場合、登録確認やパスワードリセットに影響",
      "probability": "medium",
      "impact": "high",
      "mitigation": "複数のメール配信プロバイダを検討し、フォールバック機構を実装",
      "owner": "Tech Lead"
    },
    {
      "id": "R-002",
      "description": "ブルートフォース攻撃によるアカウント乗っ取りリスク",
      "probability": "medium",
      "impact": "critical",
      "mitigation": "レート制限とアカウントロックアウト機能を実装",
      "owner": "Security Lead"
    }
  ],
  "dependencies": [
    {
      "id": "D-001",
      "description": "メール配信サービス（SendGrid/SES）の契約と設定",
      "type": "external",
      "owner": "DevOps",
      "status": "in_progress"
    },
    {
      "id": "D-002",
      "description": "データベーススキーマの設計と承認",
      "type": "technical",
      "owner": "DBA",
      "status": "resolved"
    }
  ],
  "appendix": {
    "references": [
      "OWASP Authentication Cheat Sheet",
      "NIST Digital Identity Guidelines (SP 800-63B)"
    ],
    "glossary": [
      {
        "term": "bcrypt",
        "definition": "パスワードハッシュ化のためのアルゴリズム"
      },
      {
        "term": "JWT",
        "definition": "JSON Web Token - 認証トークンの標準フォーマット"
      }
    ],
    "revision_history": [
      {
        "version": "0.1.0",
        "date": "2024-01-15",
        "author": "Product Manager",
        "changes": "初版作成"
      },
      {
        "version": "1.0.0",